{
  "schema_version": "unreal-readonly-collector-benchmark@1.0.0",
  "created_at": "2026-08-25T21:51:36.190288+00:00",
  "engine_version": "5.8.1-56057345+++UE5+Release-5.8",
  "collection_mode": "unreal_editor",
  "dataset": {
    "source": "/Engine Asset Registry",
    "selection": "first 64 sorted StaticMesh object paths with on-disk Engine Content uassets",
    "requested_count": 64,
    "asset_paths": [
      "/Engine/ArtTools/RenderToTexture/Meshes/S_1_Unit_Plane.S_1_Unit_Plane",
      "/Engine/ArtTools/RenderToTexture/Meshes/S_1_Unit_Sphere.S_1_Unit_Sphere",
      "/Engine/ArtTools/RenderToTexture/Meshes/S_1_Unit_Sphere_HI.S_1_Unit_Sphere_HI",
      "/Engine/ArtTools/RenderToTexture/Meshes/ShadowTestMesh.ShadowTestMesh",
      "/Engine/BasicShapes/Cone.Cone",
      "/Engine/BasicShapes/Cube.Cube",
      "/Engine/BasicShapes/Cube1.Cube1",
      "/Engine/BasicShapes/Cylinder.Cylinder",
      "/Engine/BasicShapes/Plane.Plane",
      "/Engine/BasicShapes/Sphere.Sphere",
      "/Engine/EditorLandscapeResources/FlattenPlaneMesh.FlattenPlaneMesh",
      "/Engine/EditorLandscapeResources/SplineEditorMesh.SplineEditorMesh",
      "/Engine/EditorMeshes/AnimTreeEd_PreviewFloor.AnimTreeEd_PreviewFloor",
      "/Engine/EditorMeshes/ArcadeEditorSphere.ArcadeEditorSphere",
      "/Engine/EditorMeshes/AssetViewer/Floor_Mesh.Floor_Mesh",
      "/Engine/EditorMeshes/AssetViewer/Sphere_inversenormals.Sphere_inversenormals",
      "/Engine/EditorMeshes/Axis_Guide.Axis_Guide",
      "/Engine/EditorMeshes/Camera/SM_CineCam.SM_CineCam",
      "/Engine/EditorMeshes/Camera/SM_CraneRig_Arm.SM_CraneRig_Arm",
      "/Engine/EditorMeshes/Camera/SM_CraneRig_Base.SM_CraneRig_Base",
      "/Engine/EditorMeshes/Camera/SM_CraneRig_Body.SM_CraneRig_Body",
      "/Engine/EditorMeshes/Camera/SM_CraneRig_Mount.SM_CraneRig_Mount",
      "/Engine/EditorMeshes/Camera/SM_RailRig_Mount.SM_RailRig_Mount",
      "/Engine/EditorMeshes/Camera/SM_RailRig_Track.SM_RailRig_Track",
      "/Engine/EditorMeshes/Cascade/BackgroundCube.BackgroundCube",
      "/Engine/EditorMeshes/ColorCalibrator/SM_ColorCalibrator.SM_ColorCalibrator",
      "/Engine/EditorMeshes/Dataflow/SM_Dataflow_Box.SM_Dataflow_Box",
      "/Engine/EditorMeshes/Dataflow/SM_Dataflow_Plane.SM_Dataflow_Plane",
      "/Engine/EditorMeshes/Dataflow/SM_Dataflow_Sphere.SM_Dataflow_Sphere",
      "/Engine/EditorMeshes/EditorCube.EditorCube",
      "/Engine/EditorMeshes/EditorCylinder.EditorCylinder",
      "/Engine/EditorMeshes/EditorHelp.EditorHelp",
      "/Engine/EditorMeshes/EditorPlane.EditorPlane",
      "/Engine/EditorMeshes/EditorShaderBall.EditorShaderBall",
      "/Engine/EditorMeshes/EditorSkySphere.EditorSkySphere",
      "/Engine/EditorMeshes/EditorSphere.EditorSphere",
      "/Engine/EditorMeshes/MatineeCam_SM.MatineeCam_SM",
      "/Engine/EditorMeshes/PhAT_FloorBox.PhAT_FloorBox",
      "/Engine/EditorMeshes/PlanarReflectionPlane.PlanarReflectionPlane",
      "/Engine/EditorResources/FieldNodes/_Resources/SM_FieldArrow.SM_FieldArrow",
      "/Engine/EngineMeshes/BackgroundCube.BackgroundCube",
      "/Engine/EngineMeshes/Cube.Cube",
      "/Engine/EngineMeshes/Cylinder.Cylinder",
      "/Engine/EngineMeshes/MaterialSphere.MaterialSphere",
      "/Engine/EngineMeshes/ParticleCube.ParticleCube",
      "/Engine/EngineMeshes/SM_MatPreviewMesh_01.SM_MatPreviewMesh_01",
      "/Engine/EngineMeshes/Sphere.Sphere",
      "/Engine/EngineMeshes/s_cube_1cm.s_cube_1cm",
      "/Engine/EngineMeshes/s_cube_1cm_flippednormals.s_cube_1cm_flippednormals",
      "/Engine/EngineSky/SM_SkySphere.SM_SkySphere",
      "/Engine/EngineVolumetrics/FalloffSphere/Mesh/S_EV_FalloffSphere_Mesh_01.S_EV_FalloffSphere_Mesh_01",
      "/Engine/EngineVolumetrics/FogEnvironment/Mesh/S_EV_FogEnvironment_01_Mesh.S_EV_FogEnvironment_01_Mesh",
      "/Engine/EngineVolumetrics/FogEnvironment/Mesh/S_EV_FogVolume_Cube_01.S_EV_FogVolume_Cube_01",
      "/Engine/EngineVolumetrics/FogEnvironment/Mesh/S_EV_FogVolume_Cylinder_01.S_EV_FogVolume_Cylinder_01",
      "/Engine/EngineVolumetrics/FogEnvironment/Mesh/S_EV_FogVolume_Sphere_01.S_EV_FogVolume_Sphere_01",
      "/Engine/EngineVolumetrics/Fogsheet/Mesh/S_EV_FogSheet_01.S_EV_FogSheet_01",
      "/Engine/EngineVolumetrics/LightBeam/Mesh/S_EV_SimpleLightBeam_01.S_EV_SimpleLightBeam_01",
      "/Engine/EngineVolumetrics/LightBeam/Mesh/S_EV_SimpleLightBeam_02.S_EV_SimpleLightBeam_02",
      "/Engine/EngineVolumetrics/LightBeam/Mesh/S_EV_SimpleLightBeam_03.S_EV_SimpleLightBeam_03",
      "/Engine/EngineVolumetrics/LightBeam/Mesh/S_EV_SimpleLightBeam_03_cross.S_EV_SimpleLightBeam_03_cross",
      "/Engine/Functions/Engine_MaterialFunctions02/ExampleContent/PivotPainter2/SimplePivotPainterExample.SimplePivotPainterExample",
      "/Engine/Functions/Engine_MaterialFunctions02/ExampleContent/TextureBasedWPO/DemoBoxMesh.DemoBoxMesh",
      "/Engine/Functions/Engine_MaterialFunctions02/ExampleContent/planes.planes",
      "/Engine/Functions/Engine_MaterialFunctions02/SupportFiles/1x1x1BoxCenterAligned.1x1x1BoxCenterAligned"
    ]
  },
  "configuration": {
    "batch_size": 64,
    "warmup_runs": 2,
    "repetitions": 7,
    "timer": "python.time.perf_counter around one C++ batch call"
  },
  "runs": [
    {
      "run_index": 0,
      "elapsed_ms": 0.5968,
      "collected_count": 64,
      "failure_count": 0
    },
    {
      "run_index": 1,
      "elapsed_ms": 0.5652,
      "collected_count": 64,
      "failure_count": 0
    },
    {
      "run_index": 2,
      "elapsed_ms": 0.5409,
      "collected_count": 64,
      "failure_count": 0
    },
    {
      "run_index": 3,
      "elapsed_ms": 0.5519,
      "collected_count": 64,
      "failure_count": 0
    },
    {
      "run_index": 4,
      "elapsed_ms": 0.5483,
      "collected_count": 64,
      "failure_count": 0
    },
    {
      "run_index": 5,
      "elapsed_ms": 0.5377,
      "collected_count": 64,
      "failure_count": 0
    },
    {
      "run_index": 6,
      "elapsed_ms": 0.5408,
      "collected_count": 64,
      "failure_count": 0
    }
  ],
  "summary": {
    "median_ms": 0.5483,
    "p95_ms": 0.5968,
    "median_assets_per_second": 116724.421,
    "stable_result_counts": true
  },
  "integrity": {
    "algorithm": "sha256",
    "hashed_asset_count": 64,
    "unchanged": true,
    "changed": []
  },
  "limitations": [
    "This is a disposable UE 5.8.1 Engine-content baseline, not a production project.",
    "Warm runs include Unreal object caching and must not be extrapolated to cold project scans.",
    "The result does not prove that thousands of project assets will avoid Editor stalls."
  ]
}
